{
  "session_id": "synthetic-training-01",
  "artifact_version": "fictional-v1",
  "criterion_version": "handoff-rc3",
  "evaluator_kind": "synthetic",
  "reference_defects": 8,
  "detected_reference_defects": 5,
  "reference_omissions": 3,
  "detected_reference_omissions": 1,
  "expected_recall_percent": 80,
  "requirements": {
    "total": 10,
    "verified": 7,
    "failed": 3,
    "unassessed": 0
  },
  "recovery": {
    "total": 6,
    "verified": 3,
    "failed": 3,
    "unassessed": 0
  },
  "unresolved_critical": 1,
  "evidence_complete": true,
  "judgment": "Ready",
  "judgment_locked_before_reference": true,
  "reference_basis": "Stipulated synthetic training key; not a participant record",
  "unsupported_findings": 0,
  "duplicate_findings": 0,
  "novel_genuine_findings": 0,
  "unresolved_findings": 0,
  "elapsed_minutes": null,
  "artifact_population": "ai_generated",
  "stage": "prototype_handoff",
  "mode": "independent_evaluation",
  "evaluator_validity": {
    "reference_frozen_before_evaluation": true,
    "reference_independent_of_findings": true,
    "evaluator_authored_artifact": false,
    "evaluator_authored_reference": false,
    "evaluator_is_adjudicator": false,
    "matches_independently_confirmed": true,
    "findings_locked_before_reference": true,
    "expected_recall_locked_before_reference": true,
    "omission_subset_frozen": true,
    "criterion_independently_established": true
  }
}
